,Unnamed: 0.1,Unnamed: 0,id,text,isRetweet,isDeleted,device,favorites,retweets,date,isFlagged,user_name,user_followers
500,500,11088,1223010091349069824,RT @RandPaul: My question today is about whether or not individuals who were holdovers from the Obama National Security Council and Democra…,t,f,Twitter for iPhone,0,39464,2020-01-30 22:28:22,f,realDonaldTrump,105100000
501,501,11095,1243596547754991619,"RT @WhiteHouse: Huge thanks to @Apple! Together with the White House, @CDCgov &amp; @fema, Apple launched a COVID19 screening tool that guides…",t,f,Twitter for iPhone,0,9020,2020-03-27 17:51:36,f,realDonaldTrump,105100000
502,502,11104,1243606997334982656,RT @SECNAV: Today #USNSMercy arrived @PortofLA to serve as a referral hospital for patients not infected with #COVID19 - handling overflow…,t,f,Twitter for iPhone,0,10179,2020-03-27 18:33:07,f,realDonaldTrump,105100000
503,503,11111,1302228546874732544,"Great job @PeteHegseth, one of a kind! @foxandfriends",f,f,Twitter for iPhone,74221,12840,2020-09-05 12:54:14,f,realDonaldTrump,105100000
504,504,11124,1233220106324451328,"Congratulations and thank you to our great Vice President &amp; all of the many professionals doing such a fine job at CDC &amp; all other agencies on the Coronavirus situation. Only a very small number in U.S., &amp; China numbers look to be going down. All countries working well together!",f,f,Twitter for iPhone,91138,18904,2020-02-28 02:39:20,f,realDonaldTrump,105100000
505,505,11126,1252801030573756416,"RT @thehill: President Trump: ""I want Harvard to pay the money back, okay? If they won't do that, then we won't do something else."" https:/…",t,f,Twitter for iPhone,0,9356,2020-04-22 03:26:56,f,realDonaldTrump,105100000
506,506,11128,1283566319405797378,"...campaign. Both were heavily involved in our historic 2016 win, and I look forward to having a big and very important second win together. This one should be a lot easier as our poll numbers are rising fast, the economy is getting better, vaccines and therapeutics will soon...",f,f,Twitter for iPhone,89954,15457,2020-07-16 00:57:12,f,realDonaldTrump,105100000
507,507,11129,1317600013363499008,"It was GREAT to be back in MICHIGAN with thousands of loyal, hardworking American Patriots — 17 days from now, we are going to win the state of MICHIGAN, and we are going to win 4 more years in the White House! #MAGA https://t.co/NNSY71n5RA",f,f,Twitter for iPhone,58189,14674,2020-10-17 22:54:57,f,realDonaldTrump,105100000
508,508,11156,1223079479393697792,"To keep America Safe, we have fully rebuilt the U.S. Military – it is now stronger, more powerful, and more lethal than ever before. Thanks to the courage of American Heroes, the ISIS Caliphate has been DESTROYED &amp; its founder &amp; leader – the animal known as al-Baghdadi – is DEAD! https://t.co/9LXDf6mJKf",f,f,Twitter for iPhone,55518,13151,2020-01-31 03:04:06,f,realDonaldTrump,105100000
509,509,11168,1223080264747737088,"Washington Dems have spent the last 3 years trying to overturn the last election – and we will make sure they face another crushing defeat in the NEXT ELECTION. Together, we are going to win back the House, we are going to hold the Senate, &amp; we are going to keep the White House! https://t.co/VshQceiwUA",f,f,Twitter for iPhone,58500,15432,2020-01-31 03:07:13,f,realDonaldTrump,105100000
510,510,11175,1243647273462005760,"We are marshalling the full power of government and society to achieve victory over the virus. Together, we will endure, we will prevail, and we will WIN! #CARESAct https://t.co/zb2PJTldGQ",f,f,Twitter for iPhone,91552,20400,2020-03-27 21:13:10,f,realDonaldTrump,105100000
511,511,11188,1252912612821667840,“Economic impact of Covid-19.” @foxandfriends Very interesting analysis. Light at the end of the tunnel. Thank you!,f,f,Twitter for iPhone,69839,13133,2020-04-22 10:50:19,f,realDonaldTrump,105100000
512,512,11227,1223252685358600192,"RT @WhiteHouse: There are many questions and concerns about the alleged whistleblower and potential conflicts of interest.

Democrats aren'…",t,f,Twitter for iPhone,0,10255,2020-01-31 14:32:21,f,realDonaldTrump,105100000
513,513,11269,1243727255911743488,"RT @USNavy: Answering the call, it's what we do. 

#USNSMercy Arrives in Los Angeles in #COVID19 response - https://t.co/lPkSZd4JLH https:/…",t,f,Twitter for iPhone,0,9304,2020-03-28 02:30:59,f,realDonaldTrump,105100000
514,514,11271,1268675068814659584,"I thought this letter from respected retired Marine and Super Star lawyer, John Dowd, would be of interest to the American People. Read it! https://t.co/I5tjysckZh",f,f,Twitter for iPhone,108239,43114,2020-06-04 22:44:41,f,realDonaldTrump,105100000
515,515,11319,1302466804506296321,"RT @Lrihendry: Joe was impressive saying:

""There's nothing we can do when we work together.""

😳",t,f,Twitter for iPhone,0,5943,2020-09-06 04:40:59,f,realDonaldTrump,105100000
516,516,11333,1302554417816907781,"....fix it, and fast. The current recipient has no chance, and won’t even try. As I have often said, Baltimore is last in everything, WHAT THE HELL DO YOU HAVE TO LOSE! Kimberly is fully Endorsed by me, something I do not do lightly. Take advantage of it and MAKE BALTIMORE GREAT!",f,f,Twitter for iPhone,63513,14231,2020-09-06 10:29:08,f,realDonaldTrump,105100000
517,517,11347,1302555138184314881,RT @charliekirk11: We knocked on thousands of doors for Trump in North Carolina today with @TrumpStudents. Biden has no ground game. The Pr…,t,f,Twitter for iPhone,0,13002,2020-09-06 10:31:59,f,realDonaldTrump,105100000
518,518,11349,1268723566046044160,"Sleepy Joe Biden’s 1994 Crime Bill was a total disaster. It was mass incarceration for Black people, many of them innocent. I did Criminal Justice Reform, something Obama &amp; Biden didn’t even try to do - &amp; couldn’t do even if they did try. Biden can never escape his Crime Bill!",f,f,Twitter for iPhone,137914,37949,2020-06-05 01:57:24,f,realDonaldTrump,105100000
519,519,11354,1233572208020205568,"It was my great honor to be back in South Carolina tonight, with thousands of hardworking American Patriots who believe in Faith, Family, God and Country. Thank you for a beautiful evening! #KAG2020 https://t.co/5vZKXLQFO3",f,f,Twitter for iPhone,60482,15125,2020-02-29 01:58:27,f,realDonaldTrump,105100000
520,520,11398,1268867999844438016,"RT @SenateGOP: Listen.

Learn.

Heal.

America: Let's stand together. 

Let's do better. https://t.co/wNt3ip2JFE",t,f,Twitter for iPhone,0,2176,2020-06-05 11:31:20,f,realDonaldTrump,105100000
521,521,11418,1302628942680068096,"Big Ten Football is looking really good, but may lose Michigan, Illinois, and Maryland because of those Governors’ ridiculous lack of interest or political support. They will play without them?",f,f,Twitter for iPhone,124212,21881,2020-09-06 15:25:16,f,realDonaldTrump,105100000
522,522,11472,1268870938201907200,RT @SenRonJohnson: Wisconsin is proud of its rich shipbuilding &amp; maritime history.  Bordered on 3 sides by commercially navigable waterways…,t,f,Twitter for iPhone,0,1465,2020-06-05 11:43:00,f,realDonaldTrump,105100000
523,523,11499,1311777753046237185,"RT @jsolomonReports: Breaking: Senate report slams Bidens for conflicts of interest, flags possible criminal activity. GOP-led investigatio…",t,f,Twitter for iPhone,0,29879,2020-10-01 21:19:22,f,realDonaldTrump,105100000
524,524,11530,1302773395638095878,RT @DonaldJTrumpJr: Thousands of Americans died and even more came home wounded because career politicians like Joe Biden voted to send the…,t,f,Twitter for iPhone,0,22963,2020-09-07 00:59:16,f,realDonaldTrump,105100000
525,525,11538,1311780087914663936,RT @JackPosobiec: American citizens just held a march for Trump in Jerusalem from the Embassy to the Old City https://t.co/WekQ8BKSdI,t,f,Twitter for iPhone,0,8060,2020-10-01 21:28:39,f,realDonaldTrump,105100000
526,526,11612,1234281253140037634,"RT @parscale: When @CNN smears Black Trump supporters just because they back the President, you know something is going right.

CNN comment…",t,f,Twitter for iPhone,0,11600,2020-03-02 00:55:57,f,realDonaldTrump,105100000
527,527,11619,1268875993093148673,RT @JerryMoran: Thank you to the thousands of people that have made this day possible. Today is another step forward down the path of explo…,t,f,Twitter for iPhone,0,1460,2020-06-05 12:03:05,f,realDonaldTrump,105100000
528,528,11667,1268877833050509312,"RT @SenDanSullivan: Julie and I pray that we can come together – as Americans, as Alaskans – to work toward justice, equality, and peace fo…",t,f,Twitter for iPhone,0,1601,2020-06-05 12:10:24,f,realDonaldTrump,105100000
529,529,11689,1253699994516946945,Just spoke to President Juan Orlando Hernandez of the Republic of Honduras. We work closely together on the Southern Border. Will be helping him with his request for Ventilators and Testing.,f,f,Twitter for iPhone,70039,13042,2020-04-24 14:59:05,f,realDonaldTrump,105100000
530,530,11707,1268878420605317120,"RT @SenDanSullivan: I want to offer my profound gratitude for Eldon, all of our Merchant Marine veterans past and present, and those servin…",t,f,Twitter for iPhone,0,1500,2020-06-05 12:12:44,f,realDonaldTrump,105100000
531,531,11708,1268878411369517057,"RT @SenDanSullivan: One Merchant Mariner I'll never forget is Eldon Gallear, who passed in 2016 but did incredible work advocating with @AM…",t,f,Twitter for iPhone,0,1608,2020-06-05 12:12:42,f,realDonaldTrump,105100000
532,532,11726,1311795005107953670,"RT @gregkellyusa: White House Correspondents, 9 out of 10 of them, are shallow and silly—-with Zero historical sense.  They are outclassed…",t,f,Twitter for iPhone,0,14213,2020-10-01 22:27:55,f,realDonaldTrump,105100000
533,533,11778,1254020552605544448,RT @CDCgov: The latest CDC #COVIDView report with new hospitalization data on race/ethnicity by age is now available https://t.co/zP4VYlo0P…,t,f,Twitter for iPhone,0,3138,2020-04-25 12:12:52,f,realDonaldTrump,105100000
534,534,11779,1234483443712561157,"Jack Welch, former Chairman and CEO of GE, a business legend, has died. There was no corporate leader like “neutron” Jack. He was my friend and supporter. We made wonderful deals together. He will never be forgotten. My warmest sympathies to his wonderful wife &amp; family!",f,f,Twitter for iPhone,75798,14325,2020-03-02 14:19:23,f,realDonaldTrump,105100000
535,535,11826,1234560222934556674,"RT @realDonaldTrump: .@BethVanDuyne did Great things as Mayor of Irving, Texas, with my Administration. She is a Strong Conservative who su…",t,f,Twitter for iPhone,0,14420,2020-03-02 19:24:28,f,realDonaldTrump,105100000
536,536,11829,1254033884137828354,"RT @CDCgov: New COVID-NET data reported more than 6,000 #COVID19 hospitalizations. Of these, almost 2,000 had race/ethnicity info. When com…",t,f,Twitter for iPhone,0,3084,2020-04-25 13:05:51,f,realDonaldTrump,105100000
537,537,11859,1303108240423768064,RT @TVNewsHQ: Fox News’ @JesseBWatters: “Something very mysterious is happening here in America. There’s a campaign to program you — you’re…,t,f,Twitter for iPhone,0,5978,2020-09-07 23:09:49,f,realDonaldTrump,105100000
538,538,11867,1303108452793962496,"RT @PeteHegseth: This Atlantic “story” is nothing but a textbook Leftist hit-job. Always anonymous. Always coordinated. And, as we’ve seen…",t,f,Twitter for iPhone,0,14979,2020-09-07 23:10:40,f,realDonaldTrump,105100000
539,539,11906,1254174221481246721,"I never said the pandemic was a Hoax! Who would say such a thing? I said that the Do Nothing Democrats, together with their Mainstream Media partners, are the Hoax. They have been called out &amp; embarrassed on this, even admitting they were wrong, but continue to spread the lie!",f,f,Twitter for iPhone,261531,52949,2020-04-25 22:23:30,f,realDonaldTrump,105100000
540,540,11987,1311423289542180865,"Just landed in Minnesota. Hasn’t been won by a Republican since 1972, and we saved Minneapolis. Also opened the massive and beautiful Iron Range, which Obama and Sleepy Joe closed.  Thousands of jobs started back. They will close again. How can we lose?",f,f,Twitter for iPhone,119251,25969,2020-09-30 21:50:51,f,realDonaldTrump,105100000
541,541,11988,1311402331934605312,"So weird to watch @FoxNews interviewing only failed Dems, like Represenative Tim Ryan of Ohio, who got zero percent in his recent presidential run, and following Sleepy Joe’s train to wherever. What a difference from the past - But we will win anyway!!!",f,f,Twitter for iPhone,90801,20487,2020-09-30 20:27:35,f,realDonaldTrump,105100000
542,542,11989,1254529069733105665,"Reports that H.H.S. Secretary @AlexAzar is going to be “fired” by me are Fake News. The Lamestream Media knows this, but they are desperate to create the perception of chaos &amp; havoc in the minds of the public. They never even called to ask. Alex is doing an excellent job!",f,f,Twitter for iPhone,85122,21056,2020-04-26 21:53:32,f,realDonaldTrump,105100000
543,543,12023,1311457668826095616,"So when will something significant happen to James Comey? Got caught cold. He is either very dumb, or one of the worst liars in political history. TOO LONG. EMBARRASSING!",f,f,Twitter for iPhone,148707,37225,2020-10-01 00:07:28,f,realDonaldTrump,105100000
544,544,12074,1303295091927326723,"Thank you Boris, working great together! https://t.co/84LabKf513",f,f,Twitter for iPhone,33759,7708,2020-09-08 11:32:18,f,realDonaldTrump,105100000
545,545,12080,1286279853910700035,RT @BuckSexton: The felony charges leveled against the armed St. Louis homeowners who refused to kneel to the protesters who broke onto the…,t,f,Twitter for iPhone,0,7785,2020-07-23 12:39:49,f,realDonaldTrump,105100000
546,546,12118,1303297441056337920,"RT @JohnWHuber: So the decision was made on the basis of the weather, but Trump might have said something after? Wow you’ve cracked this wi…",t,f,Twitter for iPhone,0,2722,2020-09-08 11:41:38,f,realDonaldTrump,105100000
547,547,12122,1286337596206055432,"Obama, who wouldn’t even endorse Biden until everyone else was out of the primaries (and even then waited a long time!), is now making a commercial of support. Remember, I wouldn’t even be here if it weren’t for them. I wouldn’t be President. They did a terrible job!",f,f,Twitter for iPhone,199744,42887,2020-07-23 16:29:16,f,realDonaldTrump,105100000
548,548,12141,1254580573072392193,"RT @EricTrump: Article should have read: Trump as businessman had a passive, non-controlling/managing interest in an office building which…",t,f,Twitter for iPhone,0,19166,2020-04-27 01:18:12,f,realDonaldTrump,105100000
549,549,12153,1254586458574401536,"RT @realDonaldTrump: I never said the pandemic was a Hoax! Who would say such a thing? I said that the Do Nothing Democrats, together with…",t,f,Twitter for iPhone,0,52949,2020-04-27 01:41:35,f,realDonaldTrump,105100000
550,550,12171,1303300131215859712,RT @chuckwoolery: Trump has been the cause of an interesting phenomenon. Republicans are now the party of the working man and the Democrats…,t,f,Twitter for iPhone,0,17883,2020-09-08 11:52:20,f,realDonaldTrump,105100000
551,551,12180,1286662316717744128,"Great job by @elonmusk in agreeing to build, in TEXAS, what is expected to be the largest auto plant anywhere in the world. He kept his word to me. Texas &amp; @Tesla are big winners. MADE IN THE USA!",f,f,Twitter for iPhone,281059,46273,2020-07-24 13:59:35,f,realDonaldTrump,105100000
552,552,12249,1313443879253946370,Wow. Joe Biden just took a more Liberal position on Roe v. Wade than Elizabeth Warren at her highest. He also wants to PACK our great United States Supreme Court. This is what the Dems will do. Remember as they try changing positions before elections end. GET OUT AND VOTE!,f,f,Twitter for iPhone,158385,39082,2020-10-06 11:39:58,f,realDonaldTrump,105100000
553,553,12267,1303340538448490497,"RT @realDonaldTrump: The Democrats, together with the corrupt Fake News Media, have launched a massive Disinformation Campaign the likes of…",t,f,Twitter for iPhone,0,56234,2020-09-08 14:32:53,f,realDonaldTrump,105100000
554,554,12277,1313503322087870465,"Mini Mike Bloomberg, who made a fool of himself on the Dems debate stage when Elizabeth Warren &amp; the others simply took him apart, is going “crazy” trying to buy his way back into the Liberal Democrat’s hearts. His Florida ads are lies. I am much better for SENIORS than Sleepy!",f,f,Twitter for iPhone,114286,25706,2020-10-06 15:36:10,f,realDonaldTrump,105100000
555,555,12325,1286992521931915265,"RT @SusanFarina6: @BrandonStraka @foxandfriends Nice interview with @PeteHegseth   I can absolutely relate, I have been a Democrat my whole…",t,f,Twitter for iPhone,0,7744,2020-07-25 11:51:43,f,realDonaldTrump,105100000
556,556,12340,1286994880808591360,@BrandonStraka Many Democrats are leaving the party over calls to Defund the Police. @foxandfriends @PeteHegseth  Great going Brandon. You really get it!!!,f,f,Twitter for iPhone,28248,8470,2020-07-25 12:01:05,f,realDonaldTrump,105100000
557,557,12359,1313637944574566402,"RT @paulsperry_: BREAKING: New agent 302s reveal McCabe directed the Flynn investigation &amp; may have had a conflict of interest, since McCab…",t,f,Twitter for iPhone,0,22213,2020-10-07 00:31:06,f,realDonaldTrump,105100000
558,558,12407,1287371355332190208,"Crazy Nancy Pelosi said I made a mistake when I banned people from infected China from entering the U.S. in January. Tens of thousands of lives were saved, as she danced in the Streets of Chinatown (SF) in late February. Biden agreed with her, but soon admitted that I was right!",f,f,Twitter for iPhone,192277,41055,2020-07-26 12:57:03,f,realDonaldTrump,105100000
559,559,12435,1287478979574800384,"RT @TVNewsHQ: Fox’s Chris Wallace: ""In our interview last week with President Trump, he questioned whether his opponent Joe Biden could han…",t,f,Twitter for iPhone,0,11736,2020-07-26 20:04:43,f,realDonaldTrump,105100000
560,560,12470,1269840254871142400,"Could it be even remotely possible that in Roger Goodell’s rather interesting statement of peace and reconciliation, he was intimating that it would now be O.K. for the players to KNEEL, or not to stand, for the National Anthem, thereby disrespecting our Country &amp; our Flag?",f,f,Twitter for iPhone,135002,29747,2020-06-08 03:54:43,f,realDonaldTrump,105100000
561,561,12527,1241672743193645056,"RT @GOPChairwoman: Together we will win this war against coronavirus. 
 
“This has been a week of national action and of great national sol…",t,f,Twitter for iPhone,0,5074,2020-03-22 10:27:05,f,realDonaldTrump,105100000
562,562,12631,1303832552243974144,"...Secret Service would not allow the trip to the cemetery based on very bad weather and security concerns. Now these low-life Biden handlers are making commercials of this fictional statement, with no proof, and think they can get away with it...",f,f,Twitter for iPhone,51915,11387,2020-09-09 23:07:59,f,realDonaldTrump,105100000
563,563,12632,1303832551241416711,"On top of a lie made up by a low-life “reporter”, who is known for disinformation, the Democrats have taken his false words and put them into a TV commercial. We now have 21 witnesses stating that the story is a BIG LIE. Even Biden admits this may not be true...",f,f,Twitter for iPhone,90508,22744,2020-09-09 23:07:58,f,realDonaldTrump,105100000
564,564,12706,1313838447011016706,"RT @hrenee80: Don’t you love it when someone  lectures you on ethics &amp; morals, while at the same time being married to one of the most corr…",t,f,Twitter for iPhone,0,18816,2020-10-07 13:47:50,f,realDonaldTrump,105100000
565,565,12725,1287754912919687169,RT @AndrewCMcCarthy: A Dubious Order against the Seattle Ban on Police Use of Non-Lethal Force - I'm not quite where @JonathanTurley is on…,t,f,Twitter for iPhone,0,4187,2020-07-27 14:21:11,f,realDonaldTrump,105100000
566,566,12738,1288968970331213830,"My Administration has been focused on finding treatments for Coronavirus. If you’ve recovered from Coronavirus, donate your plasma today to help SAVE LIVES! Together, we will beat the Virus!

🌐https://t.co/YLpBCgf837 https://t.co/IyO4livTLm",f,f,Twitter for iPhone,60990,16677,2020-07-30 22:45:25,f,realDonaldTrump,105100000
567,567,12741,1287751612040130562,RT @SenJohnThune: JUST PASSED: Good to see the Senate work together to pass a bipartisan #NDAA to ensure our troops are prepared to meet th…,t,f,Twitter for iPhone,0,2051,2020-07-27 14:08:04,f,realDonaldTrump,105100000
568,568,12757,1304035597967937536,"RT @marc_lotter: You ordered thousands of senior citizens to their death in nursing homes. 

PRESIDENT @realDonaldTrump has an army, which…",t,f,Twitter for iPhone,0,11935,2020-09-10 12:34:49,f,realDonaldTrump,105100000
569,569,12769,1287936582411067392,RT @elonmusk: The left is losing the middle,t,f,Twitter for iPhone,0,77691,2020-07-28 02:23:04,f,realDonaldTrump,105100000
570,570,12778,1289282585718190080,"Pelosi &amp; Schumer have no interest in making a deal that is good for our Country and our People. All they want is a trillion dollars, and much more, for their Radical Left Governed States, most of which are doing very badly. It is called a BAILOUT for many years of bad Dem Mgmt!",f,f,Twitter for iPhone,83125,25038,2020-07-31 19:31:36,f,realDonaldTrump,105100000
571,571,12780,1304037450793115648,"Now @FoxNews is putting on yet another loser, Jamie Weinstein, into their stable of Trump haters. People who failed for many years are now going on Fox to explain “Trump”. Schumer puppet Chris Hahn and his twin brother, Richard Goodstein, together with cheater Donna Brazil. Bad!",f,f,Twitter for iPhone,48688,13271,2020-09-10 12:42:10,f,realDonaldTrump,105100000
572,572,12783,1304037751160012800,RT @kgrandia: Saw Not Fat trending and totally thought it was something Trump said. https://t.co/3bfw4L6GJt,t,f,Twitter for iPhone,0,2198,2020-09-10 12:43:22,f,realDonaldTrump,105100000
573,573,12787,1289283987718828032,Very disappointed in @SenSchumer for blocking the temporary extension of the $600 unemployment benefits. The Do Nothing Democrats are more interested in playing politics than in helping our deserving people. DRAIN THE SWAMP ON NOVEMBER 3RD!,f,f,Twitter for iPhone,113006,36120,2020-07-31 19:37:11,f,realDonaldTrump,105100000
574,574,12900,1304236582300348417,"On November 3rd, Michigan will decide whether we will quickly return to record prosperity—or whether we allow Sleepy Joe Biden to impose a $4 TRILLION DOLLAR TAX HIKE, ban American Energy, confiscate your guns, shutdown the economy, shutdown auto production, delay...",f,f,Twitter for iPhone,89923,23184,2020-09-11 01:53:27,f,realDonaldTrump,105100000
575,575,12918,1314278414359113735,"Joe Biden has no plan for Coronavirus - ALL TALK! He was a disaster in his handling oh H1N1 Swine Flu. He didn’t have a clue, with his own Chief of Staff so saying. If he were in charge, perhaps 2.2 million people would have died from this much more lethal disease!",f,t,Twitter for iPhone,7429,2044,2020-10-08 18:56:06,f,realDonaldTrump,105100000
576,576,12921,1314279388570169345,"Joe Biden has no plan for Coronavirus - ALL TALK! He was a disaster in his handling of H1N1 Swine Flu. He didn’t have a clue, with his own Chief of Staff so saying. If he were in charge, perhaps 2.2 million people would have died from this much more lethal disease!",f,f,Twitter for iPhone,145290,32988,2020-10-08 18:59:59,f,realDonaldTrump,105100000
577,577,13063,2317112756,Donald Trump’s commercial-free WWE Raw does big rating: http://tinyurl.com/nxvquo,f,f,Twitter Web Client,19,29,2009-06-24 22:09:19,f,realDonaldTrump,105100000
578,578,13091,1314290331828060163,"RT @ChrisANethery: Nope.

Not the 25th amendment.

Elections on November 3rd.

Eyes on the prize and nevermind Twitter's shiny metal distra…",t,f,Twitter for iPhone,0,7038,2020-10-08 19:43:28,f,realDonaldTrump,105100000
579,579,13109,1290267685117460481,"My visits last week to Texas and Frorida had massive numbers of cheering people gathered along the roads and highways, thousands and thousands, even bigger (by far) than the crowds of 2016. Saw no Biden supporters, and yet some in the Fake News said it was an equal number. Sad!",f,t,Twitter for iPhone,59519,12997,2020-08-03 12:46:02,f,realDonaldTrump,105100000
580,580,13118,1290308363872538624,"My visits last week to Texas and Florida had massive numbers of cheering people gathered along the roads and highways, thousands and thousands, even bigger (by far) than the crowds of 2016. Saw no Biden supporters, and yet some in the Fake News said it was an equal number. Sad!",f,f,Twitter for iPhone,119383,25073,2020-08-03 15:27:41,f,realDonaldTrump,105100000
581,581,13151,274565038050783232,@sagethelaxbro  Hi Sage,f,f,Twitter Web Client,292,189,2012-11-30 17:26:20,f,realDonaldTrump,105100000
582,582,13166,1290692768675901440,"Whether you call it Vote by Mail or Absentee Voting, in Florida the election system is Safe and Secure, Tried and True. Florida’s Voting system has been cleaned up (we defeated Democrats attempts at change), so in Florida I encourage all to request a Ballot &amp; Vote by Mail! #MAGA",f,f,Twitter for iPhone,91642,21145,2020-08-04 16:55:10,f,realDonaldTrump,105100000
583,583,13171,1290730748132167681,I am deeply saddened by the tragic loss of eight Marines and one Sailor during a training exercise off the coast of California. Our prayers are with their families. I thank them for the brave service their loved ones gave to our Nation. #SemperFidelis,f,f,Twitter for iPhone,184546,32892,2020-08-04 19:26:05,f,realDonaldTrump,105100000
