,Unnamed: 0.1,Unnamed: 0,id,text,isRetweet,isDeleted,device,favorites,retweets,date,isFlagged,user_name,user_followers
1915,1915,47792,1020287981020729344,"China, the European Union and others have been manipulating their currencies and interest rates lower, while the U.S. is raising rates while the dollars gets stronger and stronger with each passing day - taking away our big competitive edge. As usual, not a level playing field...",f,f,Twitter for iPhone,60138,13574,2018-07-20 12:43:05,f,realDonaldTrump,105100000
1916,1916,47804,1019757603570806785,"A total disgrace that Turkey will not release a respected U.S. Pastor, Andrew Brunson, from prison. He has been held hostage far too long. @RT_Erdogan should do something to free this wonderful Christian husband &amp, father. He has done nothing wrong, and his family needs him!",f,f,Twitter for iPhone,95874,25317,2018-07-19 01:35:33,f,realDonaldTrump,105100000
1917,1917,47835,1018727890345693184,"Received many calls from leaders of NATO countries thanking me for helping to bring them together and to get them focused on financial obligations, both present &amp, future. We had a truly great Summit that was inaccurately covered by much of the media. NATO is now strong &amp, rich!",f,f,Twitter for iPhone,87985,17512,2018-07-16 05:23:50,f,realDonaldTrump,105100000
1918,1918,47849,1018488667474522112,RT @realDonaldTrump: These Russian individuals did their work during the Obama years. Why didn’t Obama do something about it?  Because he t...,t,f,Twitter for iPhone,0,32918,2018-07-15 13:33:15,f,realDonaldTrump,105100000
1919,1919,47851,1018197842559725569,"These Russian individuals did their work during the Obama years. Why didn’t Obama do something about it?  Because he thought Crooked Hillary Clinton would win, that’s why. Had nothing to do with the Trump Administration, but Fake News doesn’t want to report the truth, as usual!",f,f,Twitter for iPhone,126309,32918,2018-07-14 18:17:37,f,realDonaldTrump,105100000
1920,1920,47855,1018074723140427776,"The stories you heard about the 12 Russians yesterday took place during the Obama Administration, not the Trump Administration. Why didn’t they do something about it, especially when it was reported that President Obama was informed by the FBI in September, before the Election?",f,f,Twitter for iPhone,109225,31132,2018-07-14 10:08:23,f,realDonaldTrump,105100000
1921,1921,47857,1018070907741523968,"The stories you heard about the 12 Russians yesterday took place during the Obama Administration, not the Trump Administrations. Why didn’t they do something about it, especially when it was reported that President Obama was informed by the FBI in September, before the Election?",f,t,Twitter for iPhone,5020,1721,2018-07-14 09:53:13,f,realDonaldTrump,105100000
1922,1922,47859,1018068353305411584,"I have arrived in Scotland and will be at Trump Turnberry for two days of meetings, calls and hopefully, some golf - my primary form of exercise! The weather is beautiful, and this place is incredible! Tomorrow I go to Helsinki for a Monday meeting with Vladimir Putin.",f,f,Twitter for iPhone,73341,12112,2018-07-14 09:43:04,f,realDonaldTrump,105100000
1923,1923,47875,1014261407859249152,"RT @FLOTUS: I had a wonderful visit to @WRBethesda today.  Thank you to the many dedicated service members &amp, medical staff who take such go...",t,t,Twitter for iPhone,0,7134,2018-07-03 09:35:38,f,realDonaldTrump,105100000
1924,1924,47881,1017164990099415041,"Ex-FBI LAYER Lisa Page today defied a House of Representatives issued Subpoena to testify before Congress! Wow, but is anybody really surprised!  Together with her lover, FBI Agent Peter Strzok, she worked on the Rigged Witch Hunt, perhaps the most tainted and corrupt case EVER!",f,f,Twitter for iPhone,79894,18810,2018-07-11 21:53:26,f,realDonaldTrump,105100000
1925,1925,47930,995085901079433219,Big week next week when the American Embassy in Israel will be moved to Jerusalem. Congratulations to all!,f,f,Twitter for iPhone,124149,24725,2018-05-11 23:39:01,f,realDonaldTrump,105100000
1926,1926,47946,1014875575557804034,".....Country being forced to endure a long and costly trial. Tell the people “OUT,” and they must leave, just as they would if they were standing on your front lawn. Hiring thousands of “judges” does not work and is not acceptable - only Country in the World that does this!",f,f,Twitter for iPhone,73416,16126,2018-07-05 14:16:07,f,realDonaldTrump,105100000
1927,1927,47956,1014286089371217920,"RT @FLOTUS: I had a wonderful visit to @WRBethesda today.  Thank you to the many dedicated service members &amp, medical staff who take such go...",t,f,Twitter for iPhone,0,15544,2018-07-03 23:13:42,f,realDonaldTrump,105100000
1928,1928,47966,1014100908127543296,"How can the Democrats, who are weak on the Border and weak on Crime, do well in November. The people of our Country want and demand Safety and Security, while the Democrats are more interested in  ripping apart and demeaning (and not properly funding) our great Law Enforcement!",f,f,Twitter for iPhone,75036,16462,2018-07-03 10:57:52,f,realDonaldTrump,105100000
1929,1929,47970,1014090584963866624,"Crazy Maxine Waters, said by some to be one of the most corrupt people in politics, is rapidly becoming, together with Nancy Pelosi, the FACE of the Democrat Party. Her ranting and raving, even referring to herself as a wounded animal, will make people flee the Democrats!",f,f,Twitter for iPhone,72533,15268,2018-07-03 10:16:51,f,realDonaldTrump,105100000
1930,1930,47972,1013902140409040897,"Today, it was my great honor to welcome Prime Minister Mark Rutte of the Netherlands, to the @WhiteHouse! https://t.co/Zn6ZLM0tzy",f,f,Twitter for iPhone,58710,9829,2018-07-02 21:48:02,f,realDonaldTrump,105100000
1931,1931,48012,1012169482272460800,"Thank you North Dakota. Together, we are MAKING AMERICA SAFE AND GREAT AGAIN! #MAGA https://t.co/6Am9n6px8I",f,f,Twitter for iPhone,64522,12760,2018-06-28 03:03:04,f,realDonaldTrump,105100000
1932,1932,48014,1012082654370336768,"Today, it was my great honor to welcome President Marcelo Rebelo de Sousa of Portugal to the @WhiteHouse!🇺🇸🇵🇹 https://t.co/yd37K4Ei8R",f,f,Twitter for iPhone,51014,8554,2018-06-27 21:18:03,f,realDonaldTrump,105100000
1933,1933,48018,1011994162076573697,"Harley-Davidson should stay 100% in America, with the people that got you your success. I’ve done so much for you, and then this. Other companies are coming back where they belong! We won’t forget, and neither will your customers or your now very HAPPY competitors!",f,f,Twitter for iPhone,73007,14861,2018-06-27 15:26:24,f,realDonaldTrump,105100000
1934,1934,48021,1011931656230526976,"Congratulations to Maxine Waters, whose crazy rants have made her, together with Nancy Pelosi, the unhinged FACE of the Democrat Party. Together, they will Make America Weak Again! But have no fear, America is now stronger than ever before, and I’m not going anywhere!",f,f,Twitter for iPhone,137788,30670,2018-06-27 11:18:02,f,realDonaldTrump,105100000
1935,1935,48022,1011819474574561283,Big and conclusive win by Mitt Romney. Congratulations! I look forward to working together - there is so much good to do. A great and loving family will be coming to D.C.,f,f,Twitter for iPhone,55085,7809,2018-06-27 03:52:16,f,realDonaldTrump,105100000
1936,1936,48034,1011588967442022406,"The face of the Democrats is now Maxine Waters who, together with Nancy Pelosi, have established a fine leadership team. They should always stay together and lead the Democrats, who want Open Borders and Unlimited Crime, well into the future....and pick Crooked Hillary for Pres.",f,f,Twitter for iPhone,84522,19788,2018-06-26 12:36:18,f,realDonaldTrump,105100000
1937,1937,48048,1011295779422695424,"Congresswoman Maxine Waters, an extraordinarily low IQ person, has become, together with Nancy Pelosi, the Face of the Democrat Party. She has just called for harm to supporters, of which there are many, of the Make America Great Again movement. Be careful what you wish for Max!",f,f,Twitter for iPhone,123346,32836,2018-06-25 17:11:17,f,realDonaldTrump,105100000
1938,1938,48054,1011228265003077632,"Hiring manythousands of judges, and going through a long and complicated legal process, is not the way to go - will always be disfunctional. People must simply be stopped at the Border and told they cannot come into the U.S. illegally. Children brought back to their country......",f,f,Twitter for iPhone,79744,17871,2018-06-25 12:43:00,f,realDonaldTrump,105100000
1939,1939,48112,1009935968164630528,"You cannot pass legislation on immigration whether it be for safety and security or any other reason including “heart,” without getting Dem votes. Problem is, they don’t care about security and R’s do. Zero Dems voted to support the Goodlatte Bill. They won’t vote for anything!",f,f,Twitter for iPhone,71336,18698,2018-06-21 23:07:53,f,realDonaldTrump,105100000
1940,1940,48129,1009770941604298753,"We shouldn’t be hiring judges by the thousands, as our ridiculous immigration laws demand, we should be changing our laws, building the Wall, hire Border Agents and Ice and not let people come into our country based on the legal phrase they are told to say as their password.",f,f,Twitter for iPhone,89419,22105,2018-06-21 12:12:07,f,realDonaldTrump,105100000
1941,1941,48132,1009602111133442048,"Thank you Duluth, Minnesota. Together, we are MAKING AMERICA GREAT AGAIN! https://t.co/G0hbbx6xAK",f,f,Twitter for iPhone,61972,13008,2018-06-21 01:01:15,f,realDonaldTrump,105100000
1942,1942,48144,1009431025817092097,"It’s the Democrats fault, they won’t give us the votes needed to pass good immigration legislation. They want open borders, which breeds horrible crime. Republicans want security. But I am working on something - it never ends!",f,f,Twitter for iPhone,81954,18561,2018-06-20 13:41:25,f,realDonaldTrump,105100000
1943,1943,48158,1009071326219395073,I can’t think of something more concerning than a law enforcement officer suggesting that their going to use their powers to affect an election!” Inspector General Horowitz on what was going on with numerous people regarding my election. A Rigged Witch Hunt!p,f,f,Twitter for iPhone,72491,16439,2018-06-19 13:52:06,f,realDonaldTrump,105100000
1944,1944,48168,1008511869970255872,"The Democrats should get together with their Republican counterparts and work something out on Border Security &amp, Safety. Don’t wait until after the election because you are going to lose!",f,f,Twitter for iPhone,76194,15666,2018-06-18 00:49:01,f,realDonaldTrump,105100000
1945,1945,48224,1006866089110892545,"The U.S., together with Mexico and Canada, just got the World Cup. Congratulations - a great deal of hard work!",f,f,Twitter for iPhone,89012,16039,2018-06-13 11:49:16,f,realDonaldTrump,105100000
1946,1946,48227,1006837823469735936,"Just landed - a long trip, but everybody can now feel much safer than the day I took office. There is no longer a Nuclear Threat from North Korea. Meeting with Kim Jong Un was an interesting and very positive experience. North Korea has great potential for the future!",f,f,Twitter for iPhone,90701,17825,2018-06-13 09:56:57,f,realDonaldTrump,105100000
1947,1947,48233,1006694541083021312,"The World has taken a big step back from potential Nuclear catastrophe! No more rocket launches, nuclear testing or research! The hostages are back home with their families. Thank you to Chairman Kim, our day together was historic!",f,f,Twitter for iPhone,131430,26412,2018-06-13 00:27:36,f,realDonaldTrump,105100000
1948,1948,48236,1006688157096501248,"There is no limit to what NoKo can achieve when it gives up its nuclear weapons and embraces commerce &amp, engagement w/ the world. Chairman Kim has before him the opportunity to be remembered as the leader who ushered in a glorious new era of security &amp, prosperity for his citizens! https://t.co/Xbup4Zyz33",f,f,Twitter for iPhone,71292,14420,2018-06-13 00:02:14,f,realDonaldTrump,105100000
1949,1949,48248,1006286790536323074,"Meetings between staffs and representatives are going well and quickly....but in the end, that doesn’t matter. We will all know soon whether or not a real deal, unlike those of the past, can happen!",f,f,Twitter for iPhone,89795,16997,2018-06-11 21:27:21,f,realDonaldTrump,105100000
1950,1950,48260,1005554687678922752,I am on my way to Singapore where we have a chance to achieve a truly wonderful result for North Korea and the World. It will certainly be an exciting day and I know that Kim Jong-un will work very hard to do something that has rarely been done before...,f,f,Twitter for iPhone,87925,18497,2018-06-09 20:58:14,f,realDonaldTrump,105100000
1951,1951,48280,1004814196247318528,"PM Abe and I are also working to improve the trading relationship between the U.S. and Japan, something we have to do. The U.S. seeks a bilateral deal with Japan that is based on the principle of fairness and reciprocity. We’re working hard to reduce our trade imbalance... https://t.co/pnqEHoplk0",f,f,Twitter Media Studio,41266,8096,2018-06-07 19:55:47,f,realDonaldTrump,105100000
1952,1952,48281,1004813164066766848,"Today, I am greatly honored to welcome my good friend, PM Abe of Japan to the @WhiteHouse. Over the past 16 months the Prime Minister and I have worked closely together to address common challenges, of which there are many... https://t.co/sNlmdd6fgm",f,f,Twitter Media Studio,42629,7896,2018-06-07 19:51:41,f,realDonaldTrump,105100000
1953,1953,48293,1004711557291560960,When and where will all of the many conflicts of interest be listed by the 13 Angry Democrats (plus) working on the Witch Hunt Hoax. There has never been a group of people on a case so biased or conflicted. It is all a Democrat Excuse for LOSING the Election. Where is the server?,f,f,Twitter for iPhone,61661,14137,2018-06-07 13:07:56,f,realDonaldTrump,105100000
1954,1954,48307,1004211778837012481,"Mitch McConnell announced he will cancel the Senate’s August Recess. Great, maybe the Democrats will finally get something done other than their acceptance of High Crime and High Taxes. We need Border Security!",f,f,Twitter for iPhone,74718,15644,2018-06-06 04:02:00,f,realDonaldTrump,105100000
1955,1955,48316,1004160401658073090,"Wow, Strzok-Page, the incompetent &amp, corrupt FBI lovers, have texts referring to a counter-intelligence operation into the Trump Campaign dating way back to December, 2015. SPYGATE is in full force! Is the Mainstream Media interested yet? Big stuff!",f,f,Twitter for iPhone,74780,23065,2018-06-06 00:37:50,f,realDonaldTrump,105100000
1956,1956,48325,1003969399148118016,Separating families at the Border is the fault of bad legislation passed by the Democrats. Border Security laws should be changed but the Dems can’t get their act together! Started the Wall.,f,f,Twitter for iPhone,69787,14960,2018-06-05 11:58:52,f,realDonaldTrump,105100000
1957,1957,48327,1003963157734453249,Meeting in Singapore with North Korea will hopefully be the start of something big...we will soon see!,f,f,Twitter for iPhone,67787,12487,2018-06-05 11:34:04,f,realDonaldTrump,105100000
1958,1958,48359,1002971013313908738,"The United States must, at long last, be treated fairly on Trade. If we charge a country ZERO to sell their goods, and they charge us 25, 50 or even 100 percent to sell ours, it is UNFAIR and can no longer be tolerated. That is not Free or Fair Trade, it is Stupid Trade!",f,f,Twitter for iPhone,109212,25116,2018-06-02 17:51:38,f,realDonaldTrump,105100000
1959,1959,48388,1002027245131661312,"“The recusal of Jeff Sessions was an unforced betrayal of the President of the United States.” JOE DIGENOVA, former U.S. Attorney.",f,f,Twitter for iPhone,54681,12580,2018-05-31 03:21:26,f,realDonaldTrump,105100000
1960,1960,48401,1001807174249713664,"Rep.Trey Gowdy, “I don’t think so, I think what the President is doing is expressing frustration that Attorney General Sessions should have shared these reasons for recusal before he took the job, not afterward. If I were the President and I picked someone to be the country’s....",f,f,Twitter for iPhone,49703,10796,2018-05-30 12:46:57,f,realDonaldTrump,105100000
1961,1961,48408,1001410457092218880,"We have put a great team together for our talks with North Korea. Meetings are currently taking place concerning Summit, and more. Kim Young Chol, the Vice Chairman of North Korea, heading now to New York. Solid response to my letter, thank you!",f,f,Twitter for iPhone,63540,13458,2018-05-29 10:30:32,f,realDonaldTrump,105100000
1962,1962,48420,1000837182297464832,"Why didn’t President Obama do something about the so-called Russian Meddling when he was told about it by the FBI before the Election? Because he thought Crooked Hillary was going to win, and he didn’t want to upset the apple cart! He was in charge, not me, and did nothing.",f,f,Twitter for iPhone,107482,27273,2018-05-27 20:32:33,f,realDonaldTrump,105100000
1963,1963,48454,999687630060118016,"It was my great honor to host a roundtable re: MS-13 yesterday in Bethpage, New York. Democrats must abandon their resistance to border security so that we can SUPPORT law enforcement and SAVE innocent lives! https://t.co/pxe9Z4efyZ",f,f,Twitter Media Studio,48929,10269,2018-05-24 16:24:38,f,realDonaldTrump,105100000
1964,1964,48463,999435250571726848,"Thank you to all of the incredible law enforcement officers and firefighters in Bethpage, New York. Keep up the great work! https://t.co/SMaZ8Hfas4",f,f,Twitter for iPhone,49833,9381,2018-05-23 23:41:47,f,realDonaldTrump,105100000
1965,1965,48490,998524172858019840,"I ask Senator Chuck Schumer, why didn’t President Obama &amp, the Democrats do something about Trade with China, including Theft of Intellectual Property etc.? They did NOTHING! With that being said, Chuck &amp, I have long agreed on this issue! Fair Trade, plus, with China will happen!",f,f,Twitter for iPhone,66758,13865,2018-05-21 11:21:29,f,realDonaldTrump,105100000
1966,1966,48491,998256454590193665,"I hereby demand, and will do so officially tomorrow, that the Department of Justice look into whether or not the FBI/DOJ infiltrated or surveilled the Trump Campaign for Political Purposes - and if any such demands or requests were made by people within the Obama Administration!",f,f,Twitter for iPhone,155485,43704,2018-05-20 17:37:40,f,realDonaldTrump,105100000
1967,1967,48529,996822738101825538,"Lou Barletta will be a great Senator for Pennsylvania but his opponent, Bob Casey, has been a do-nothing Senator who only shows up at election time. He votes along the Nancy Pelosi, Elizabeth Warren lines, loves sanctuary cities, bad and expensive healthcare...",f,f,Twitter for iPhone,49175,11281,2018-05-16 18:40:35,f,realDonaldTrump,105100000
1968,1968,48541,996391840860471296,"Can you believe that with all of the made up, unsourced stories I get from the Fake News Media, together with the  $10,000,000 Russian Witch Hunt (there is no Collusion), I now have my best Poll Numbers in a year. Much of the Media may be corrupt, but the People truly get it!",f,f,Twitter for iPhone,119596,25407,2018-05-15 14:08:21,f,realDonaldTrump,105100000
1969,1969,48546,996119678551552000,"ZTE, the large Chinese phone company, buys a big percentage of individual parts from U.S. companies. This is also reflective of the larger trade deal we are negotiating with China and my personal relationship with President Xi.",f,f,Twitter for iPhone,53873,9966,2018-05-14 20:06:53,f,realDonaldTrump,105100000
1970,1970,48547,996046634864791557,#USEmbassyJerusalem https://t.co/f1SFvrkcAH,f,f,Twitter for iPhone,54888,12706,2018-05-14 15:16:38,f,realDonaldTrump,105100000
1971,1971,48549,995980604016611329,"U.S. Embassy opening in Jerusalem will be covered live on @FoxNews &amp, @FoxBusiness. Lead up to 9:00 A.M. (eastern) event has already begun. A great day for Israel!",f,f,Twitter for iPhone,72814,14067,2018-05-14 10:54:15,f,realDonaldTrump,105100000
1972,1972,48552,995746011321597953,"China and the United States are working well together on trade, but past negotiations have been so one sided in favor of China, for so many years, that it is hard for them to make a deal that benefits both countries. But be cool, it will all work out!",f,f,Twitter for iPhone,86256,15835,2018-05-13 19:22:03,f,realDonaldTrump,105100000
1973,1973,48553,995680316458262533,"President Xi of China, and I, are working together to give massive Chinese phone company, ZTE, a way to get back into business, fast. Too many jobs in China lost. Commerce Department has been instructed to get it done!",f,f,Twitter for iPhone,72061,14047,2018-05-13 15:01:00,f,realDonaldTrump,105100000
1974,1974,48592,993443781281271808,"To the great people of West Virginia we have, together, a really great chance to keep making a big difference. Problem is, Don Blankenship, currently running for Senate, can’t win the General Election in your State...No way! Remember Alabama. Vote Rep. Jenkins or A.G. Morrisey!",f,f,Twitter for iPhone,50457,11703,2018-05-07 10:53:49,f,realDonaldTrump,105100000
1975,1975,48609,991994433750142976,"...very common among celebrities and people of wealth. In this case it is in full force and effect and will be used in Arbitration for damages against Ms. Clifford (Daniels). The agreement was used to stop the false and extortionist accusations made by her about an affair,......",f,f,Twitter for iPhone,64827,13138,2018-05-03 10:54:38,f,realDonaldTrump,105100000
1976,1976,48615,991776286489169920,"I have been briefed on the U.S. C-130 “Hercules” cargo plane from the Puerto Rico National Guard that crashed near Savannah Hilton Head International Airport. Please join me in thoughts and prayers for the victims, their families and the great men and women of the National Guard.",f,f,Twitter for iPhone,80863,15866,2018-05-02 20:27:47,f,realDonaldTrump,105100000
1977,1977,48636,990782291667488768,"The White House Correspondents’ Dinner was a failure last year, but this year was an embarrassment to everyone associated with it. The filthy “comedian” totally bombed (couldn’t even deliver her lines-much like the Seth Meyers weak performance). Put Dinner to rest, or start over!",f,f,Twitter for iPhone,90510,17909,2018-04-30 02:38:00,f,realDonaldTrump,105100000
1978,1978,48639,990557728752926725,"While Washington, Michigan, was a big success, Washington, D.C., just didn’t work. Everyone is talking about the fact that the White House Correspondents Dinner was a very big, boring bust...the so-called comedian really “bombed.” @greggutfeld should host next year! @PeteHegseth",f,f,Twitter for iPhone,72526,14832,2018-04-29 11:45:40,f,realDonaldTrump,105100000
1979,1979,48640,990551654952067073,"Great evening last night in Washington, Michigan. The enthusiasm, knowledge and love in that room was unreal. To the many thousands of people who couldn’t get in, I cherish you....and will be back!",f,f,Twitter for iPhone,93191,16874,2018-04-29 11:21:32,f,realDonaldTrump,105100000
1980,1980,48651,989948140814991360,I urge all Americans to participate in #takebackday tomorrow! Let’s come together and BEAT last October’s record of disposed prescription pills! Visit https://t.co/QCG7bHvvxd to learn more on how to participate Saturday and every day. https://t.co/W00YxL1RwK,f,f,Twitter for iPhone,42014,9271,2018-04-27 19:23:23,f,realDonaldTrump,105100000
1981,1981,48662,989650212380692480,"The U.S. has put together a STRONG bid w/ Canada &amp, Mexico for the 2026 World Cup. It would be a shame if countries that we always support were to lobby against the U.S. bid. Why should we be supporting these countries when they don’t support us (including at the United Nations)?",f,f,Twitter for iPhone,84406,18171,2018-04-26 23:39:32,f,realDonaldTrump,105100000
1982,1982,48672,988874988169121792,"RT @realDonaldTrump: Our two great republics are linked together by the timeless bonds of history, culture, and destiny. We are people who...",t,t,Twitter for iPhone,0,1503,2018-04-24 08:19:04,f,realDonaldTrump,105100000
1983,1983,48673,988874883990999040,"Our two great republics are linked together by the timeless bonds of history, culture, and destiny. We are people who cherish our values, protect our civilization, and recognize the image of God in every human soul. https://t.co/01c8iSGDB3",f,f,Twitter Media Studio,81107,16298,2018-04-24 20:18:39,f,realDonaldTrump,105100000
1984,1984,48694,987774054651301888,"James Comey’s Memos are Classified, I did not Declassify them. They belong to our Government! Therefore, he broke the law! Additionally, he totally made up many of the things he said I said, and he is already a proven liar and leaker. Where are Memos on Clinton, Lynch &amp, others?",f,f,Twitter for iPhone,64163,16332,2018-04-21 19:24:21,f,realDonaldTrump,105100000
1985,1985,48707,987532088302886913,A message from Kim Jong Un: “North Korea will stop nuclear tests and launches of intercontinental ballistic missiles.”Also will “Shut down a nuclear test site in the country’s Northern Side to prove the vow to suspend nuclear tests.” Progress being made for all!,f,f,Twitter for iPhone,121413,25357,2018-04-21 03:22:51,f,realDonaldTrump,105100000
1986,1986,48736,986643179452747776,Best wishes to Prime Minister @Netanyahu and all of the people of Israel on the 70th Anniversary of your Great Independence. We have no better friends anywhere. Looking forward to moving our Embassy to Jerusalem next month!,f,f,Twitter for iPhone,87135,19104,2018-04-18 16:30:39,f,realDonaldTrump,105100000
